EDCS-ID	publication	province	place	dating_from	dating_to	date_not_before	date_not_after	status	inscription	inscription_conservative_cleaning	inscription_interpretive_cleaning	material	comment	latitude	longitude	language	photo	partner_link	extra_text	extra_html	raw_dating
EDCS-58400073	CIL 03, 12133 = TAM-02-S, 00001 = MH-1986-136 = ZPE-21-277 = AE 2007, +00043	Lycia et Pamphylia	Duver / Tlos					Augusti/Augustae;  leges;  liberti/libertae;  litterae erasae;  servi/servae;  viri	]lita [3] / in eum qui convinctus f[3]n dicetur quod si minime potue/rit eaeque intentaveri[t 3] probare scire debet severiori sen/tentiae subiugandum sane si quis alicui maiestatis crimen / intenderit cum eiusmodi obiectus minime quemquam pri/vilegio dignitatis alicuius inquisitione tueatur / sciat se quoque tormentis esse subdendum si [ali]is manifestis in/diciis adque argumentis accusationem su[a]m non potuerit con/probare cum in eo qui huius esse [di]gnitatis deprehendetur il/lud quoque tormentis erui oporteat cuius consilio adque in/stinctu ad accusationem accessisse videatur ut ab omnibus tan/ti comissi consciis vindicta possit reportari / delatoribus autem quod adeundi quoque iudici(i)s tam statu/tis parentum nostrorum quam etiam nostris sanctionibus / interclusa sit facultas omnibus cognitum est cum eius/modi hominibus audientia non debeat commodari quandoqui/dem eos pro tanti sceleris audacia poenae conveniat subiugari / in servis quoque sive libertis qui dominos vel patronos accu/sare aut deferre temptant eiusmodi legem iuxta antiqui / quoque iuris statutum observandam esse censuimus ut scili/cet professio tam atrocis audaciae statim in admissi ipsius exor/dio per sententiam iudicis comprimatur ac denegatur audien/[tia // Imp(erator) Ca[es(ar) Gal(erius) Val(erius) Maximianus P(ius) F(elix) Invict(us) Aug(ustus)] / po[nt(ifex) max(imus) Germ(anicus) max(imus) VII Aegypt(icus) max(imus) Theb(aicus) max(imus)] / Sar[m(ticus) max(imus) V Persic(us) max(imus) III Brit(annicus) max(imus) II Carp(icus)] / ma[x(imus) VI Arm(eniacus) max(imus) Med(icus) max(imus) Adiab(enicus) max(imus) trib(unicia) pot(estate)] / XV[IIII cons(ul) VII imp(erator) XVIII p(ater) p(atriae) procons(ul) et] / Imp(erator) Ca[es(ar) Val(erius) Lic(inianus) Licinius P(ius) F(elix) Inv(ictus) Aug(ustus) pont(ifex) max(imus)] / tr[ib(unicia) pot(estate) III cons(ul) imp(erator) 3 p(ater) p(atriae) procons(ul) et] / [[Imp(erator) Ca[es(ar) Gal(erius) Val(erius) Maximinus P(ius) F(elix) Inv(ictus) Aug(ustus) pont(ifex)]]] / [[ma[x(imus) trib(unicia) pot(estate) VI cons(ul) imp(erator) VI p(ater) p(atriae) oricins(ul) et]]] / Imp(erator) Ca[es(ar) Flav(ius) Val(erius) Constantinus P(ius) F(elix) Inv(ictus) Aug(ustus)] / po[nt(ifex) max(imus) trib(unicia) pot(estate) V imp(erator) V p(ater) p(atriae) procons(ul)] / Pii[ssimi 3 dicunt] / cunc[t 3] / ALI[3] / GEN[3] / DEM[3] / PRIN[3] / AV[3] / GE[3] / HE[3] / EX[ //	lita in eum qui convinctus f n dicetur quod si minime potuerit eae que intentaveri probare scire debet severiori sententiae subiugandum sane si quis alicui maiestatis crimen intenderit cum eiusmodi obiectus minime quemquam privilegio dignitatis alicuius inquisitione tueatur sciat se quo que tormentis esse subdendum si is manifestis indiciis ad que argumentis accusationem sum non potuerit conprobare cum in eo qui huius esse gnitatis deprehendetur illud quo que tormentis erui oporteat cuius consilio ad que instinctu ad accusationem accessisse videatur ut ab omnibus tanti comissi consciis vindicta possit reportari delatoribus autem quod adeundi quo que iudicis tam statutis parentum nostrorum quam etiam nostris sanctionibus interclusa sit facultas omnibus cognitum est cum eiusmodi hominibus audientia non debeat commodari quandoquidem eos pro tanti sceleris audacia poenae conveniat subiugari in servis quo que sive libertis qui dominos vel patronos accusare aut deferre temptant eiusmodi legem iuxta antiqui quo que iuris statutum observandam esse censuimus ut scilicet professio tam atrocis audaciae statim in admissi ipsius exordio per sententiam iudicis comprimatur ac denegatur audientia Imp Ca po Sar ma XV Imp Ca tr Imp Ca ma Imp Ca po Pii cunc ALI GEN DEM PRIN AV GE HE EX	lita in eum qui convinctus f n dicetur quod si minime potuerit eae que intentaverit probare scire debet severiori sententiae subiugandum sane si quis alicui maiestatis crimen intenderit cum eiusmodi obiectus minime quemquam privilegio dignitatis alicuius inquisitione tueatur sciat se quo que tormentis esse subdendum si aliis manifestis indiciis ad que argumentis accusationem suam non potuerit conprobare cum in eo qui huius esse dignitatis deprehendetur illud quo que tormentis erui oporteat cuius consilio ad que instinctu ad accusationem accessisse videatur ut ab omnibus tanti comissi consciis vindicta possit reportari delatoribus autem quod adeundi quo que iudiciis tam statutis parentum nostrorum quam etiam nostris sanctionibus interclusa sit facultas omnibus cognitum est cum eiusmodi hominibus audientia non debeat commodari quandoquidem eos pro tanti sceleris audacia poenae conveniat subiugari in servis quo que sive libertis qui dominos vel patronos accusare aut deferre temptant eiusmodi legem iuxta antiqui quo que iuris statutum observandam esse censuimus ut scilicet professio tam atrocis audaciae statim in admissi ipsius exordio per sententiam iudicis comprimatur ac denegatur audientia Imperator Caesar Galerius Valerius Maximianus Pius Felix Invictus Augustus pontifex maximus Germanicus maximus VII Aegypticus maximus Thebaicus maximus Sarmticus maximus V Persicus maximus III Britannicus maximus II Carpicus maximus VI Armeniacus maximus Medicus maximus Adiabenicus maximus tribunicia potestate XVIIII consul VII imperator XVIII pater patriae proconsul et Imperator Caesar Valerius Licinianus Licinius Pius Felix Invictus Augustus pontifex maximus tribunicia potestate III consul imperator pater patriae proconsul et Imperator Caesar Galerius Valerius Maximinus Pius Felix Invictus Augustus pontifex maximus tribunicia potestate VI consul imperator VI pater patriae oricinsul et Imperator Caesar Flavius Valerius Constantinus Pius Felix Invictus Augustus pontifex maximus tribunicia potestate V imperator V pater patriae proconsul Piissimi dicunt cunct ALI GEN DEM PRIN AV GE HE EX			36.5539383	29.4187024			http://db.edcs.eu/epigr/partner.php?s_language=en&param=bu_CIL%26bibl_volume=3%26bibl_subvolume=%26bibl_insc=12133			
EDCS-58400074	CIL 03, 12134 = TAM-02-S, 00001 = AE 1996, 01498 = AE 2007, +00043	Lycia et Pamphylia	Duver / Tlos	305	305	305	305	leges	] iustame[3 diligente]r pendentes ne qua forte / [3]tata latuisset cuius occasio temeritati supra / [memoratorum insidiandi pec]uniis innocentium aliquam tribueret facultatem / [competentibus remedi]is censuimus corrigendam placet itaque ut quicu[mque] / [in diem XIII Kal(endas) Octobres] consulatus scilicet nostri Constanti et Maximiani / [Augg(ustorum) V ex adnotationibu]s eorum qui adversae fortunae arbitriis subiugati{o} locum / [fisco fecerant calumnias] sustinebant hi pi{a}etatis nostrae beneficiis liberentur / [nec deinceps ullas o]mnino huiusquemodi fiscales molestias pertimescant si / [enim iniquum liberalitat]is nostrae sensibus visum sit ex his scripturis aliquos con[veniri] / [quas aut inimicus ulc]iscendi se etiam post obitum studio infensus adscribit au[t] / [tamquam in semen luc]rorum seu etiam praedationum immoderata Caesarianorum / [nequitia et exsecranda co]nmenta est et quo huiusmodi inquietudinum tituli s[tirpitus] / [amputati semper consopiant]ur noscite sanctionis nostrae processisse mandat[a ut] / [omnes omnino adnotatio]nes que in diem supra memoratum penes fisci offici[a remansissent] / [in libellis seu membranis seu] etiam chartis aut in quibuslibet instrumentis / [ilico ad comitatum nostru]m mitterentur scilicet ne{c} etiam post ista nost[rae pietatis] / [beneficia remanentibus h]uiusquemodi instrumentis penes officia sup[ra dicta more] / [consueto semper spoliand]i provinciales nostros Caesarianis inpertire[tur occasio nec] / [postea nisi ex manifesti]s probationibus et cautionibus rite conscripti[s] / [in fiscale iudicium vocar]etur illis etiam significationum nostrarum in[structione] / [mandatis ut si quae deince]ps pari casu fisci nostri rationibus adnotationes s[uppeditarentur] / [nullo eorum nomine interp]ellato omnes ad comitatum nostrum ilico dir[igerentur] / [Unde perspicitur iuxta consti]tutam nostrae clementiae sanctionem si cui [ex hoc] / [	iustame r pendentes ne qua forte tata latuisset cuius occasio temeritati supra uniis innocentium aliquam tribueret facultatem is censuimus corrigendam placet ita que ut quicu consulatus scilicet nostri Constanti et Maximiani s eorum qui adversae fortunae arbitriis subiugatio locum sustinebant hi piaetatis nostrae beneficiis liberentur mnino huiusquemodi fiscales molestias pertimescant si is nostrae sensibus visum sit ex his scripturis aliquos con iscendi se etiam post obitum studio infensus adscribit au rorum seu etiam praedationum immoderata Caesarianorum nmenta est et quo huiusmodi inquietudinum tituli s ur noscite sanctionis nostrae processisse mandat nes que in diem supra memoratum penes fisci offici etiam chartis aut in quibuslibet instrumentis m mitterentur scilicet nec etiam post ista nost uiusquemodi instrumentis penes officia sup i provinciales nostros Caesarianis inpertire s probationibus et cautionibus rite conscripti etur illis etiam significationum nostrarum in ps pari casu fisci nostri rationibus adnotationes s ellato omnes ad comitatum nostrum ilico dir tutam nostrae clementiae sanctionem si cui	iustame diligenter pendentes ne qua forte tata latuisset cuius occasio temeritati supra memoratorum insidiandi pecuniis innocentium aliquam tribueret facultatem competentibus remediis censuimus corrigendam placet ita que ut quicum que in diem XIII Kalendas Octobres consulatus scilicet nostri Constanti et Maximiani Auggustorum V ex adnotationibus eorum qui adversae fortunae arbitriis subiugati locum fisco fecerant calumnias sustinebant hi pietatis nostrae beneficiis liberentur nec deinceps ullas omnino huiusquemodi fiscales molestias pertimescant si enim iniquum liberalitatis nostrae sensibus visum sit ex his scripturis aliquos conveniri quas aut inimicus ulciscendi se etiam post obitum studio infensus adscribit aut tamquam in semen lucrorum seu etiam praedationum immoderata Caesarianorum nequitia et exsecranda conmenta est et quo huiusmodi inquietudinum tituli stirpitus amputati semper consopiantur noscite sanctionis nostrae processisse mandata ut omnes omnino adnotationes que in diem supra memoratum penes fisci officia remansissent in libellis seu membranis seu etiam chartis aut in quibuslibet instrumentis ilico ad comitatum nostrum mitterentur scilicet ne etiam post ista nostrae pietatis beneficia remanentibus huiusquemodi instrumentis penes officia supra dicta more consueto semper spoliandi provinciales nostros Caesarianis inpertiretur occasio nec postea nisi ex manifestis probationibus et cautionibus rite conscriptis in fiscale iudicium vocaretur illis etiam significationum nostrarum instructione mandatis ut si quae deinceps pari casu fisci nostri rationibus adnotationes suppeditarentur nullo eorum nomine interpellato omnes ad comitatum nostrum ilico dirigerentur Unde perspicitur iuxta constitutam nostrae clementiae sanctionem si cui ex hoc			36.5539383	29.4187024			http://db.edcs.eu/epigr/partner.php?s_language=en&param=HD050420;bu_CIL%26bibl_volume=3%26bibl_subvolume=%26bibl_insc=12134			305 to 305
EDCS-31300077	IGRRP-03, 00551 = D 08818	Lycia et Pamphylia	Duver / Tlos						Ποπλίῳ Βαιβίῳ Ποπλίου / υἱῷ Ὠφεντείνα Ἰταλικῷ / ταμίᾳ Κύπρου δημάρχῳ / πρεσβευτῇ Γαλλίας Νάρ/βωνο[ς] στρα[τ]ηγῷ πρεσ/[βευτῇ λε]γεῶνος ιδʹ διδύ/[μης Ἀρέ]ας νεικητικῆς / [τετειμ]ημένῳ ἐν τῷ / [κατὰ Γε]ρμανίαν πολέμῳ / [ὑπὸ τοῦ] Σεβαστοῦ στεφά/[νῳ χρυσ]ῷ καὶ πυργωτῷ / [καὶ οὐαλ]λαρίῳ καὶ δόρα/[σιν καθ]αροῖς γʹ καὶ σημέ/[αις γʹ(?) πρ]εσβευτῇ Αὐτοκρά/[τορος Κ]αίσαρος [[Δ[ομετια]]]/[νοῦ Σε]βαστοῦ [[Γ[ερμανι]]]/[κοῦ καὶ] ἀντιστρατήγῳ Λυ/[κίας κα]ὶ Παμφυλίας τῷ / [εὐεργ]έτῃ καὶ κτίστῃ καὶ / [δικαιο]δότῃ ἁγνῷ / [Τλω]έων ὁ δῆμος	Ποπλίῳ Βαιβίῳ Ποπλίου υἱῷ Ὠφεντείνα Ἰταλικῷ ταμίᾳ Κύπρου δημάρχῳ πρεσβευτῇ Γαλλίας Νάρβωνο στραηγῷ πρεσγεῶνος ιδʹ διδύας νεικητικῆς ημένῳ ἐν τῷ ρμανίαν πολέμῳ Σεβαστοῦ στεφάῷ καὶ πυργωτῷ λαρίῳ καὶ δόρααροῖς γʹ καὶ σημέεσβευτῇ Αὐτοκράαίσαρος Δβαστοῦ Γ ἀντιστρατήγῳ Λυὶ Παμφυλίας τῷ έτῃ καὶ κτίστῃ καὶ δότῃ ἁγνῷ έων ὁ δῆμος	Ποπλίῳ Βαιβίῳ Ποπλίου υἱῷ Ὠφεντείνα Ἰταλικῷ ταμίᾳ Κύπρου δημάρχῳ πρεσβευτῇ Γαλλίας Νάρβωνος στρατηγῷ πρεσβευτῇ λεγεῶνος ιδʹ διδύμης Ἀρέας νεικητικῆς τετειμημένῳ ἐν τῷ κατὰ Γερμανίαν πολέμῳ ὑπὸ τοῦ Σεβαστοῦ στεφάνῳ χρυσῷ καὶ πυργωτῷ καὶ οὐαλλαρίῳ καὶ δόρασιν καθαροῖς γʹ καὶ σημέαις γʹ πρεσβευτῇ Αὐτοκράτορος Καίσαρος Δομετιανοῦ Σεβαστοῦ Γερμανικοῦ καὶ ἀντιστρατήγῳ Λυκίας καὶ Παμφυλίας τῷ εὐεργέτῃ καὶ κτίστῃ καὶ δικαιοδότῃ ἁγνῷ Τλωέων ὁ δῆμος			36.5539383	29.4187024			http://db.edcs.eu/epigr/partner.php?s_language=en&param=P284451;de-b1021			
EDCS-31300076	IGRRP-03, 00556 = D 08840	Lycia et Pamphylia	Duver / Tlos						τὸν λαμπρότατον / Τιβ(έριον) Πωλλήνιον Ἀ[ρμέ]νιον Περεγρεῖνο[ν] / τὸν εὐγενέστατον / ὠρδινάριον ὕπατον / καὶ ὑγιέστατον ἄνθ(ρωπον) / τῷ κοινῷ δόγματι τοῦ λαμπροτάτου τῶν Λυ/κίων ἔθνους Μ(ᾶρκος) Αὐρ(ήλιος) / Διονύσιος ὁ Λυκιάρ/χης καθʼ ἃ ἐν τῷ κο[ι]νοβουλίω ὑπέσχ[ε]το	τὸν λαμπρότατον Τιβ Πωλλήνιον Ἀνιον Περεγρεῖνο τὸν εὐγενέστατον ὠρδινάριον ὕπατον καὶ ὑγιέστατον ἄνθ τῷ κοινῷ δόγματι τοῦ λαμπροτάτου τῶν Λυκίων ἔθνους Μ Αὐρ Διονύσιος ὁ Λυκιάρχης καθʼ ἃ ἐν τῷ κονοβουλίω ὑπέσχτο	τὸν λαμπρότατον Τιβέριον Πωλλήνιον Ἀρμένιον Περεγρεῖνον τὸν εὐγενέστατον ὠρδινάριον ὕπατον καὶ ὑγιέστατον ἄνθρωπον τῷ κοινῷ δόγματι τοῦ λαμπροτάτου τῶν Λυκίων ἔθνους Μᾶρκος Αὐρήλιος Διονύσιος ὁ Λυκιάρχης καθʼ ἃ ἐν τῷ κοινοβουλίω ὑπέσχετο			36.5539383	29.4187024			http://db.edcs.eu/epigr/partner.php?s_language=en&param=de-b1028			
EDCS-63800169	SEG-27, 00940 = SEG-50, 01356a	Lycia et Pamphylia	Duver / Tlos					miliaria	 // mi(liarium) I	mi I	miliarium I	lapis		36.5539383	29.4187024	GR					
EDCS-70200283	RRMAM-02-01, 00849 = RRMAM-03-06, 00020 = SEG-31, 01295 = SEG-36, 01467	Lycia et Pamphylia	Esen	198	305	198	305	Augusti/Augustae;  miliaria;  viri				lapis		36.4558655	29.2810022	GR					198 to 305
EDCS-78300793	AE 1929, 00033 = SEG-06, 00615	Lycia et Pamphylia	Gaa Mezarlik					milites;  mulieres;  tituli honorarii;  viri	ἡ βουλὴ καὶ / ὁ δῆμος ἐτείμ[ησεν] / Αὐρ Μοδεστία[ν] / Σαβεῖναν τὴν ἀξ[ιο]/λογωτάτην γυναῖκα / τοῦ ἀξιολογωτάτου / Αὐρ(ηλίου) Καλλιστράτου / οὐετρανοῦ ἀπὸ κορ/νουκουλαρίου	ἡ βουλὴ καὶ ὁ δῆμος ἐτείμ Αὐρ Μοδεστία Σαβεῖναν τὴν ἀξλογωτάτην γυναῖκα τοῦ ἀξιολογωτάτου Αὐρ Καλλιστράτου οὐετρανοῦ ἀπὸ κορνουκουλαρίου	ἡ βουλὴ καὶ ὁ δῆμος ἐτείμησεν Αὐρ Μοδεστίαν Σαβεῖναν τὴν ἀξιολογωτάτην γυναῖκα τοῦ ἀξιολογωτάτου Αὐρηλίου Καλλιστράτου οὐετρανοῦ ἀπὸ κορνουκουλαρίου	lapis						http://db.edcs.eu/epigr/partner.php?s_language=en&param=P282299;1ae1929-10			
EDCS-77400234	AE 1899, 00173	Lycia et Pamphylia	Gelemis / Patara / Arsinoe						(D)(is) [M(anibus)] / [T(ito) Aelio] l[ib(erto) Aug(usti) Vi]/[tali vice p]r[ocurato]/[ris XX heredit]atiu[m] / reg(ionis) Lyciacae heres / eius cura agente / cum lib(ertis) eius Aelio / Sosia et Aelio Epaga/tho Θ(εοῖς) Δ(αίμοσιν) / Τ(ίτῳ) Αἰλίῳ Σεβ(αστοῦ) ἀπελευ/θ(έρῳ) Οὐειταλίῳ ἀν/τεπιτρόπῳ κʹ κλη/ρονομιῶν ἐπαρχε[ί]/[ας Λ]υκίας κληρο[νό]/[μος αὐ]τοῦ ἐπ[ιμελ(ούμενος)] / [συ]νπρ(ασσόντ?)ων ἀπ[ελευθ(έρων)] / αὐτοῦ Αἰλί[ου Σωσ]/ία καὶ Αἰλίου Ἐ[παγ]/άθου	lratiu reg Lyciacae heres eius cura agente cum lib eius Aelio Sosia et Aelio Epagatho Θ Δ Τ Αἰλίῳ Σεβ ἀπελευθ Οὐειταλίῳ ἀντεπιτρόπῳ κʹ κληρονομιῶν ἐπαρχευκίας κληροτοῦ ἐπ νπρων ἀπ αὐτοῦ Αἰλίία καὶ Αἰλίου Ἐάθου	Dis Manibus Tito Aelio liberto Augusti Vitali vice procuratoris XX hereditatium regionis Lyciacae heres eius cura agente cum libertis eius Aelio Sosia et Aelio Epagatho Θεοῖς Δαίμοσιν Τίτῳ Αἰλίῳ Σεβαστοῦ ἀπελευθέρῳ Οὐειταλίῳ ἀντεπιτρόπῳ κʹ κληρονομιῶν ἐπαρχείας Λυκίας κληρονόμος αὐτοῦ ἐπιμελούμενος συνπρασσόντων ἀπελευθέρων αὐτοῦ Αἰλίου Σωσία καὶ Αἰλίου Ἐπαγάθου	lapis		36.2761364	29.3182337			http://db.edcs.eu/epigr/partner.php?s_language=en&param=P284349;1ae1899-49			
EDCS-67200752	AE 2001, 01931 = AE 2004, 01528 = AE 2005, 01506	Lycia et Pamphylia	Gelemis / Patara / Arsinoe	45	46	45	46		Τιβερίωι [Κλ]αυδίωι / Δρούσου [υἱ]ῶι Καί/σαρι Σεβαστῶι Γερ/μανικῶι ἀρχιερεῖ [μ]ε/γίστωι δ[η]μαρχικῆς / ἐξου[σί]ας τὸ πέμ/πτον α[ὐ]το/κράτορι τὸ ἑνδέκα/τον πατρὶ πατρί/δος ὑπάτω[ι τ]ὸ τέ/ταρτον ἀπο[δε]δει/γμέν[ωι τῶι] σωτῆρ[ι τ]οῦ / ἑαυτῶν ἔθνους Λ[ύ]/κιοι φιλορώμαιοι καὶ / φιλοκ[α]ίσαρες πισ/τοὶ σύμμαχοι ἀπαλ/λα[γέ]ν[τε]ς στάσε/ως καὶ ἀνομίας και λη/σ[τ]ειῶν [δι]ὰ τὴν θείαν / αὐτο[ῦ] πρόνοιαν ἀ/πειληφότες δὲ ὁμό/[νοια]ν καὶ τὴν ἴσην δ[ι]/[και]ο[δ]οσίαν καὶ τοὺς / [πατρίου(?)]ς νόμους / τῆς πολιτείας τοῖς / ἐξ ἀρίστων ἐ[π]ιλελε/γμένοις βουλευ/ταῖς ἀπὸ τοῦ ἀκρίτου / πλήθους π[ι]στευ/[θεί]σης [ἀντὶ πολλῶν] / [ὧν] ὑπʼ [αὐτοῦ εὐεργε]/τήθησα[ν(?) διὰ Κοίντου] / Οὐηραν[ίου πρεσβευ]/τοῦ κ[αὶ ἀντι]στρατή/γου Τιβερίου Κλαυ/δίου Καίσαρος Σεβαστοῦ	Τιβερίωι αυδίωι Δρούσου ῶι Καίσαρι Σεβαστῶι Γερμανικῶι ἀρχιερεῖ εγίστωι δμαρχικῆς ἐξουας τὸ πέμπτον ατοκράτορι τὸ ἑνδέκατον πατρὶ πατρίδος ὑπάτωὸ τέταρτον ἀποδειγμέν σωτῆροῦ ἑαυτῶν ἔθνους Λκιοι φιλορώμαιοι καὶ φιλοκίσαρες πιστοὶ σύμμαχοι ἀπαλλανς στάσεως καὶ ἀνομίας και λησειῶν ὰ τὴν θείαν αὐτο πρόνοιαν ἀπειληφότες δὲ ὁμόν καὶ τὴν ἴσην δοοσίαν καὶ τοὺς ς νόμους τῆς πολιτείας τοῖς ἐξ ἀρίστων ἐιλελεγμένοις βουλευταῖς ἀπὸ τοῦ ἀκρίτου πλήθους πστευσης ὑπʼ τήθησα Οὐηραντοῦ κστρατήγου Τιβερίου Κλαυδίου Καίσαρος Σεβαστοῦ	Τιβερίωι Κλαυδίωι Δρούσου υἱῶι Καίσαρι Σεβαστῶι Γερμανικῶι ἀρχιερεῖ μεγίστωι δημαρχικῆς ἐξουσίας τὸ πέμπτον αὐτοκράτορι τὸ ἑνδέκατον πατρὶ πατρίδος ὑπάτωι τὸ τέταρτον ἀποδεδειγμένωι τῶι σωτῆρι τοῦ ἑαυτῶν ἔθνους Λύκιοι φιλορώμαιοι καὶ φιλοκαίσαρες πιστοὶ σύμμαχοι ἀπαλλαγέντες στάσεως καὶ ἀνομίας και ληστειῶν διὰ τὴν θείαν αὐτοῦ πρόνοιαν ἀπειληφότες δὲ ὁμόνοιαν καὶ τὴν ἴσην δικαιοδοσίαν καὶ τοὺς πατρίους νόμους τῆς πολιτείας τοῖς ἐξ ἀρίστων ἐπιλελεγμένοις βουλευταῖς ἀπὸ τοῦ ἀκρίτου πλήθους πιστευθείσης ἀντὶ πολλῶν ὧν ὑπʼ αὐτοῦ εὐεργετήθησαν διὰ Κοίντου Οὐηρανίου πρεσβευτοῦ καὶ ἀντιστρατήγου Τιβερίου Κλαυδίου Καίσαρος Σεβαστοῦ			36.2761364	29.3182337			http://db.edcs.eu/epigr/partner.php?s_language=en&param=HD037109			45 to 46
EDCS-67200753	AE 2001, 01933	Lycia et Pamphylia	Gelemis / Patara / Arsinoe						Φλάβιος Βάσσος / πρειμο[π]ειλά[ριο]ς / θεῷ ἐπη[κόῳ Ἀπό]λ/λωνι Πατ[ρῴῳ τὰς] λυ/χνίας σὺν [τοῖς] λύ/χνοις χαριστή[ριον]	Φλάβιος Βάσσος πρειμοειλάς θεῷ ἐπηλλωνι Πατ λυχνίας σὺν λύχνοις χαριστή	Φλάβιος Βάσσος πρειμοπειλάριος θεῷ ἐπηκόῳ Ἀπόλλωνι Πατρῴῳ τὰς λυχνίας σὺν τοῖς λύχνοις χαριστήριον			36.2761364	29.3182337			http://db.edcs.eu/epigr/partner.php?s_language=en&param=HD037110			
EDCS-69200476	AE 2013, 01645a	Lycia et Pamphylia	Gelemis / Patara / Arsinoe					nomen singulare;  sigilla impressa;  tituli fabricationis;  viri	Appule()	Appule	Appule	opus figlinae		36.2761364	29.3182337						
EDCS-69200477	AE 2013, 01645b	Lycia et Pamphylia	Gelemis / Patara / Arsinoe					sigilla impressa;  tituli fabricationis	[C]CI	CI	CCI	opus figlinae		36.2761364	29.3182337						
EDCS-69200478	AE 2013, 01645c	Lycia et Pamphylia	Gelemis / Patara / Arsinoe					praenomen et nomen;  servi/servae;  sigilla impressa;  tituli fabricationis;  viri	Mahe(s) Albi	Mahe Albi	Mahes Albi	opus figlinae		36.2761364	29.3182337						
EDCS-69200479	AE 2013, 01645d	Lycia et Pamphylia	Gelemis / Patara / Arsinoe					sigilla impressa;  tituli fabricationis	LCCVS	LCCVS	LCCVS	opus figlinae		36.2761364	29.3182337						
EDCS-22300491	CIL 03, 00234 = TAM-02-02, 00462	Lycia et Pamphylia	Gelemis / Patara / Arsinoe					mulieres;  tituli sepulcrales;  tria nomina;  viri	D(is) M(anibus) / Flavia Kapi/tolina vixit / annis XXXXVI cui / M(arcus) Aemilius Sulla / et M(arcus) Aemilius Capito/linus filii eius / matri piissimae / mon<u=I>mentum / de suo institu/erunt	D M Flavia Kapitolina vixit annis XXXXVI cui M Aemilius Sulla et M Aemilius Capitolinus filii eius matri piissimae monImentum de suo instituerunt	Dis Manibus Flavia Kapitolina vixit annis XXXXVI cui Marcus Aemilius Sulla et Marcus Aemilius Capitolinus filii eius matri piissimae monumentum de suo instituerunt			36.2761364	29.3182337						
EDCS-72900009	CIL 03, 06740	Lycia et Pamphylia	Gelemis / Patara / Arsinoe					tituli possessionis;  tria nomina;  viri	P(ubli) Qu(i)nti / Co<g=C>itati	P Qunti CoCitati	Publi Quinti Cogitati			36.2761364	29.3182337						
