EDCS-ID	publication	province	place	dating_from	dating_to	date_not_before	date_not_after	status	inscription	inscription_conservative_cleaning	inscription_interpretive_cleaning	material	comment	latitude	longitude	language	photo	partner_link	extra_text	extra_html	raw_dating
EDCS-29900553	CIL 03, 14207,37 = ADBulgar 00073 = IBulgarien 00030	Thracia	Ikhtiman / Serdica	317	324	317	324	Augusti/Augustae;  miliaria;  viri	DD(ominorum) nn(ostrorum) / Constantini Max(imi) / Val(eri) Lic(iniani) Licini p[e]rp(etuorum) Augg(ustorum) / Fl(avi) Iul(i) Crispi / Val(eri) Lic(iniani) L[i]cini Iun(ioris) / Fl(avi) Cl(audi) Constantini / nobb(ilissimorum) Caess(arum)	DD nn Constantini Max Val Lic Licini prp Augg Fl Iul Crispi Val Lic Lcini Iun Fl Cl Constantini nobb Caess	DDominorum nnostrorum Constantini Maximi Valeri Liciniani Licini perpetuorum Auggustorum Flavi Iuli Crispi Valeri Liciniani Licini Iunioris Flavi Claudi Constantini nobbilissimorum Caessarum	lapis		42.4384955	23.8143825		http://db.edcs.eu/epigr/bilder.php?bilder.php?s_language=en&bild=$IBulgarien_00030.jpg	http://db.edcs.eu/epigr/partner.php?s_language=en&param=HD042904			317 to 324
EDCS-81000109	ArchBulg-2019-51,8	Thracia	Ilientsi						D(omino) n(ostro) / Imp(eratori) C[aes(ari)] / Fl(avio) Cl(audio) Iuli[ano Pio Fel(ici)] / venerab[ili ac trium]/fatori se[mper Augusto] / [ // Arc]adio / [semper Augg(ustorum?)] bo/[no rei publica]e / [natis]	D n Imp C Fl Cl Iuli venerabfatori se adio boe	Domino nostro Imperatori Caesari Flavio Claudio Iuliano Pio Felici venerabili ac triumfatori semper Augusto Arcadio semper Auggustorum bono rei publicae natis			42.7511932	23.3161434		http://db.edcs.eu/epigr/bilder.php?bilder.php?s_language=en&bild=$ArchBulg-2019-51-8.jpg				
EDCS-29900551	IBulgarien 00027	Thracia	Ivanyane / Ivanjane / Serdica	401	500	401	500	nomen singulare;  tituli sepulcrales;  viri	[Seb]astianus / [in m]emoriam	astianus emoriam	Sebastianus in memoriam			42.705770	23.181860			http://db.edcs.eu/epigr/partner.php?s_language=en&param=HD042901			401 to 500
EDCS-78300431	AE 1912, 00119	Thracia	Iwajlowgrad / Ivaylovgrad					tria nomina;  viri	ἀγαθῇ τύχῃ / Αἴλιος Φίρμενος φυλαρχή/σας εὐχαριστήριον ἀνέ/θηκεν	ἀγαθῇ τύχῃ Αἴλιος Φίρμενος φυλαρχήσας εὐχαριστήριον ἀνέθηκεν	ἀγαθῇ τύχῃ Αἴλιος Φίρμενος φυλαρχήσας εὐχαριστήριον ἀνέθηκεν	lapis		41.5258135	26.1234902			http://db.edcs.eu/epigr/partner.php?s_language=en&param=P169932;1ae1912-34			
EDCS-16400069	AE 1911, 00017	Thracia	Izvor	117	150	117	150	milites;  tituli sacri;  tria nomina;  viri	Apollini / Tadeno Ae/lius Tar/sas |(centurio) coh(ortis) / II Lucensi/um memo/riae causa{e} / v(otum) l(ibens) s(olvit)	Apollini Tadeno Aelius Tarsas coh II Lucensium memoriae causae v l s	Apollini Tadeno Aelius Tarsas centurio cohortis II Lucensium memoriae causa votum libens solvit			41.5549823	21.6975832			http://db.edcs.eu/epigr/partner.php?s_language=en&param=HD028659;1ae1911-04			117 to 150
EDCS-31400043	CIL 03, 12329 = IDeultum p 56b = AE 2017, 01263	Thracia	Jakasli	71	300	71	300	termini	F(ines) c(oloniae) D(eultensium)	F c D	Fines coloniae Deultensium	lapis		42.492500	27.403203		http://db.edcs.eu/epigr/bilder.php?bilder.php?s_language=en&bild=$IDeultum-56b.jpg;$CIL_03_12329.jpg	http://db.edcs.eu/epigr/partner.php?s_language=en&param=HD068278			71 to 300
EDCS-09200484	AE 1978, 00729	Thracia	Kabile / Cabyle	151	250	151	250	milites;  tituli sepulcrales;  tria nomina;  viri	D(is) M(anibus) / Val(erio) Proculo / vet(erano) qui vixit / annis LX L(ucius) / Valerius / Valens eq(ues) / fratri b(ene) m(erenti) posu/it	D M Val Proculo vet qui vixit annis LX L Valerius Valens eq fratri b m posuit	Dis Manibus Valerio Proculo veterano qui vixit annis LX Lucius Valerius Valens eques fratri bene merenti posuit			42.5288087	26.4770012		http://db.edcs.eu/epigr/bilder.php?bilder.php?s_language=en&bild=$AE_1978_00729.jpg	http://db.edcs.eu/epigr/partner.php?s_language=en&param=HD004345			151 to 250
EDCS-09200485	AE 1978, 00730	Thracia	Kabile / Cabyle	151	300	151	300	milites;  mulieres;  nomen singulare;  tituli operum;  tituli sepulcrales;  tria nomina;  viri	D(is) M(anibus) / Val(eria) Festiva et Ulp(ius) Vi/tales(!) Damanaeo Ama/zeni generi(!) suo milit(i) / car(cerario) leg(ionis) mil(itavit) an(nos) XXIIII vix(it) / an(nos) XXXX cui bene mer(enti) / aram posuerunt	D M Val Festiva et Ulp Vitales Damanaeo Amazeni generi suo milit car leg mil an XXIIII vix an XXXX cui bene mer aram posuerunt	Dis Manibus Valeria Festiva et Ulpius Vitales Damanaeo Amazeni generi suo militi carcerario legionis militavit annos XXIIII vixit annos XXXX cui bene merenti aram posuerunt			42.5288087	26.4770012		http://db.edcs.eu/epigr/bilder.php?bilder.php?s_language=en&bild=$AE_1978_00730_1.jpg;$AE_1978_00730_2.jpg	http://db.edcs.eu/epigr/partner.php?s_language=en&param=HD004753			151 to 300
EDCS-72400140	AE 1999, 01371 = AE 1991, 01403	Thracia	Kabile / Cabyle	135	136	135	136	Augusti/Augustae;  milites;  ordo senatorius;  tituli operum;  tituli sacri;  tria nomina;  viri	[Imp(eratori) Cae]s(ari) divi Traiani / [Parth(ici) fil(io)] divi Nervae ne/[poti Trai]ano Hadriano / [Aug(usto) po]ntif(ici) max(imo) trib(unicia) po/[test(ate) XX(?) i]mp(eratori) II co(n)s(uli) III p(atri) p(atriae) / [3 Cava]rio Frontone leg(ato) / [Aug(usti)] pr(o) pr(aetore) / [coh(ors) II L]ucensium fecit	s divi Traiani divi Nervae neano Hadriano ntif max trib pomp II cos III p p rio Frontone leg pr pr ucensium fecit	Imperatori Caesari divi Traiani Parthici filio divi Nervae nepoti Traiano Hadriano Augusto pontifici maximo tribunicia potestate XX imperatori II consuli III patri patriae Cavario Frontone legato Augusti pro praetore cohors II Lucensium fecit			42.5288087	26.4770012		http://db.edcs.eu/epigr/bilder.php?bilder.php?s_language=en&bild=$AE_1999_01371.jpg	http://db.edcs.eu/epigr/partner.php?s_language=en&param=HD043728			135 to 136
EDCS-16200559	AE 1999, 01373	Thracia	Kabile / Cabyle	117	138	117	138	Augusti/Augustae;  tituli honorarii;  tituli sacri;  viri	Imp(eratori) [Caes(ari) divi Traiani] / Part[h(ici) f(ilio) divi Nervae ne]/[poti Ha]/dr[iano Aug(usto)	Imp Partdriano Aug	Imperatori Caesari divi Traiani Parthici filio divi Nervae nepoti Hadriano Augusto			42.5288087	26.4770012			http://db.edcs.eu/epigr/partner.php?s_language=en&param=HD043729			117 to 138
EDCS-78300257	AE 1999, 01374b = SEG-42, 00646b = SEG-54, 00638 = AE 2017, 01266a7	Thracia	Kabile / Cabyle	309	310	309	310	Augusti/Augustae;  ordo decurionum;  ordo senatorius;  tituli honorarii;  tituli sacri;  tria nomina;  viri	ἀγαθῆιτύχηι / ὑπὲρ ὑγίας κα[ὶ νείκη]ς καὶ ἐωνίου δ[ιαμονῆς] / τῶν δ[εσποτῶν ἡ]μῶν Γαλ(ερίου) Οὐαλ(ερίου) Μα[ξιμιανοῦ] / καὶ Λικ[ιννιανοῦ Λικι]ννίου [Σεβ(αστῶν) καὶ Γαλ(ερίου) Οὐαλ(ερίου)] / Μαξιμ[ίνου] Καίσαρος [καὶ Φλαουίου Οὐαλερίου] / [Κονσ]ταντίνου ὑίω βασιλ[έως καὶ βασι]/[λίσσ]ης ἡμῶν Γαλερίας Οὐα[λερίας 3] / [3 δ]ιασημότατος [ἡγε]μὼν τ[ῆς Θρᾴκης] / [3]Ν κατεσκεύα[σεν 3] / [3]ΙΝ [τῶν] Καβυληνῶν [3] / ΤΗΛΑΝ[3]ΝΙΟΥ ἐπιμε[λ]ουμ[ένων] / Μάρ(κου) Αὐρ(ηλίου) ΣυΙ[3]αινου ΔΕΚΑΠ[3]/λιανοῦ καὶ [3]ιβιανοῦ καὶ Πύρο[ς 3] / [3]Χ[3 εὐτυ]χῶς	ἀγαθῆιτύχηι ὑπὲρ ὑγίας κας καὶ ἐωνίου δ τῶν δμῶν Γαλ Οὐαλ Μα καὶ Λικννίου Μαξιμ Καίσαρος ταντίνου ὑίω βασιλης ἡμῶν Γαλερίας Οὐα ιασημότατος μὼν τ Ν κατεσκεύα ΙΝ Καβυληνῶν ΤΗΛΑΝ ΝΙΟΥ ἐπιμεουμ Μάρ Αὐρ ΣυΙ αινου ΔΕΚΑΠ λιανοῦ καὶ ιβιανοῦ καὶ Πύρο Χ χῶς	ἀγαθῆιτύχηι ὑπὲρ ὑγίας καὶ νείκης καὶ ἐωνίου διαμονῆς τῶν δεσποτῶν ἡμῶν Γαλερίου Οὐαλερίου Μαξιμιανοῦ καὶ Λικιννιανοῦ Λικιννίου Σεβαστῶν καὶ Γαλερίου Οὐαλερίου Μαξιμίνου Καίσαρος καὶ Φλαουίου Οὐαλερίου Κονσταντίνου ὑίω βασιλέως καὶ βασιλίσσης ἡμῶν Γαλερίας Οὐαλερίας διασημότατος ἡγεμὼν τῆς Θρᾴκης Ν κατεσκεύασεν ΙΝ τῶν Καβυληνῶν ΤΗΛΑΝ ΝΙΟΥ ἐπιμελουμένων Μάρκου Αὐρηλίου ΣυΙ αινου ΔΕΚΑΠ λιανοῦ καὶ ιβιανοῦ καὶ Πύρος Χ εὐτυχῶς	lapis		42.5288087	26.4770012			http://db.edcs.eu/epigr/partner.php?s_language=en&param=P171926			309 to 310
EDCS-16200561	AE 1999, 01377 = AE 2017, 01266a2	Thracia	Kabile / Cabyle	151	200	151	200	milites;  tituli sacri;  tria nomina	Au]/luzeni(s) m[il(es)] / coh(ortis) II Lucens(ium) / v(otum) s(olvit) l(ibens) m(erito)	Auluzeni m coh II Lucens v s l m	Auluzenis miles cohortis II Lucensium votum solvit libens merito	lapis		42.5288087	26.4770012			http://db.edcs.eu/epigr/partner.php?s_language=en&param=HD045097;bu_AE%26bibl_volume=1999%26bibl_subvolume=%26bibl_insc=1377			151 to 200
EDCS-73200095	AiB-2018-05-07	Thracia	Kabile / Cabyle	166	169	166	169	milites;  ordo equester;  ordo senatorius;  tituli operum;  tria nomina;  viri	Balineum coh(ortis) / II Luc(ensium) perfectum / sub Cl(audio) Martiale / leg(ato) Aug(usti) pr(o) pr(aetore) pro(vinciae) / Thr(aciae) curante Ael(io) / Rufo praef(ecto) / coh(ortis) eiusd(em)	Balineum coh II Luc perfectum sub Cl Martiale leg Aug pr pr pro Thr curante Ael Rufo praef coh eiusd	Balineum cohortis II Lucensium perfectum sub Claudio Martiale legato Augusti pro praetore provinciae Thraciae curante Aelio Rufo praefecto cohortis eiusdem			42.5288087	26.4770012		http://db.edcs.eu/epigr/bilder.php?bilder.php?s_language=en&bild=$AiB-2018-05-07.jpg	http://db.edcs.eu/epigr/partner.php?s_language=en&param=http://archaeologyinbulgaria.com/2018/07/05/intact-roman-inscription-from-marcus-aurelius-rule-found-in-ancient-thracian-city-kabyle-in-southeast-bulgaria/			166 to 169
EDCS-05000733	BEJA-2017-207 = AE 1985, 00769 = AE 1991, 01404	Thracia	Kabile / Cabyle	135	136	135	136	Augusti/Augustae;  ordo senatorius;  tituli operum;  tituli sacri;  viri	[Imp(eratori) Caes(ari) divi Traiani] / [Parth(ici) f(ilio) divi Nervae ne]/[poti Traiano Hadriano] / [Aug(usto) po]ntif(ici) ma[x(imo) trib(unicia)] / [pot(estate)] XX imp(eratori) II co[(n)s(uli) III p(atri) p(atriae)] / [Cavar]io Fronto[ne leg(ato)] / [Aug(usti)] pr(o) pr[(aetore)	ntif ma XX imp II co io Fronto pr pr	Imperatori Caesari divi Traiani Parthici filio divi Nervae nepoti Traiano Hadriano Augusto pontifici maximo tribunicia potestate XX imperatori II consuli III patri patriae Cavario Frontone legato Augusti pro praetore			42.5288087	26.4770012			http://db.edcs.eu/epigr/partner.php?s_language=en&param=HD007092			135 to 136
EDCS-72400141	BEJA-2017-208 = SEG-42, 00646 = AE 1999, 01374 = Pahl-2010, 00008 = AnTard-2004-285 = AE 2017, 01266a1 = AE 2018, +01416	Thracia	Kabile / Cabyle	208	208	208	208	Augusti/Augustae;  litterae erasae;  milites;  mulieres;  ordo senatorius;  tituli operum;  tituli sacri;  viri	ἀ[γαθῆι] τύχηι // [Bona] Fortuna I(ovi) O(ptimo) M(aximo) Dol(i)c[heno] / pro [salute] dd(ominorum) nn(ostrorum) Impp(eratorum) L(uci) Sept(imi) Se[veri] / e(t) M(arci) [Aur(eli)] Antonino Aug[g(ustorum)] [[[e]t P(ubli) S[epti]]]/[[[mi Get]ae [C]aes(aris)]] et Iul(iae) [Domnae Au]g(ustae) et / c[o]hort<is=E> I Athoitorum(!) s[ub p]raesi/de Q(uinto) Egnati(o) Proculo leg(ato) Au[gg(ustorum) pr(o)] / pr(aetore) fecerunt templum Anton[ius(?) 3]N / [3 P]hybathenion I[3] / [3 A]pollinarius M[3] / [3 s]ua Imp(eratore) Ant(onino) III [[et P(ublio) Se[p]ti]]/[[mio Geta I[I]]] [co(n)s(ulibus) 3]I Kal(endas) Fe<b=R>r(u)ari(a)s // εὐτυ[χῶς το]ῖς κυρίοις // AESI // ἀγαθῆι τύχηι / ὑπὲρ ὑγίας κα[ὶ νείκη]ς καὶ ἐωνίου δ[ιαμονῆς] / τῶν δ[εσποτῶν ἡ]μῶν Γαλ(ερίου) Οὐαλ(ερίου) Μα[ξιμιανοῦ] / καὶ Λικ[ιννιανοῦ Λικι]ννίου [Σεβ(αστῶν) καὶ Γαλ(ερίου) Οὐαλ(ερίου)] / Μαξιμ[ίνου] Καίσαρος [καὶ Φλαουίου Οὐαλερίου] / [Κονσ]ταντίνου ὑιῶ[ν] βασιλ[έων καὶ τῆς δεσ]/[ποίν]ης ἡμῶν Γαλερίας Οὐα[λερίας Σεβασ] / [τῆς ὁ δ]ιασημότατος [ἡγε]μὼν τ[ῆς Θρᾴκης 3] / [3]Ν κατεσκεύα[σεν 3] / [3]Ν [τῶν] Καβυληνῶν [3] / ΤΗΛΑΝ[3]ΝΙΟΥ ἐπιμε[λ]ουμ[ένων] / Μάρ(κου) Αὐρ(ηλίου) Συ[3]αινου δεκα[πρτου 3]/λιανοῦ καὶ [2]ιβιανοῦ καὶ Πύρο[ς 3] / [3]ξ εὐτυ[χῶς]	ἀ τύχηι Fortuna I O M Dolc pro dd nn Impp L Sept Se e M Antonino Aug t P Sae et Iul g et chortE I Athoitorum sraeside Q Egnati Proculo leg Au pr fecerunt templum Anton N hybathenion I pollinarius M ua Imp Ant III et P Semio Geta I I Kal FeRraris εὐτυῖς κυρίοις AESI ἀγαθῆι τύχηι ὑπὲρ ὑγίας κας καὶ ἐωνίου δ τῶν δμῶν Γαλ Οὐαλ Μα καὶ Λικννίου Μαξιμ Καίσαρος ταντίνου ὑιῶ βασιλης ἡμῶν Γαλερίας Οὐα ιασημότατος μὼν τ Ν κατεσκεύα Ν Καβυληνῶν ΤΗΛΑΝ ΝΙΟΥ ἐπιμεουμ Μάρ Αὐρ Συ αινου δεκα λιανοῦ καὶ ιβιανοῦ καὶ Πύρο ξ εὐτυ	ἀγαθῆι τύχηι Bona Fortuna Iovi Optimo Maximo Dolicheno pro salute ddominorum nnostrorum Impperatorum Luci Septimi Severi et Marci Aureli Antonino Auggustorum et Publi Septimi Getae Caesaris et Iuliae Domnae Augustae et cohortis I Athoitorum sub praeside Quinto Egnatio Proculo legato Auggustorum pro praetore fecerunt templum Antonius N Phybathenion I Apollinarius M sua Imperatore Antonino III et Publio Septimio Geta II consulibus I Kalendas Februarias εὐτυχῶς τοῖς κυρίοις AESI ἀγαθῆι τύχηι ὑπὲρ ὑγίας καὶ νείκης καὶ ἐωνίου διαμονῆς τῶν δεσποτῶν ἡμῶν Γαλερίου Οὐαλερίου Μαξιμιανοῦ καὶ Λικιννιανοῦ Λικιννίου Σεβαστῶν καὶ Γαλερίου Οὐαλερίου Μαξιμίνου Καίσαρος καὶ Φλαουίου Οὐαλερίου Κονσταντίνου ὑιῶν βασιλέων καὶ τῆς δεσποίνης ἡμῶν Γαλερίας Οὐαλερίας Σεβασ τῆς ὁ διασημότατος ἡγεμὼν τῆς Θρᾴκης Ν κατεσκεύασεν Ν τῶν Καβυληνῶν ΤΗΛΑΝ ΝΙΟΥ ἐπιμελουμένων Μάρκου Αὐρηλίου Συ αινου δεκαπρτου λιανοῦ καὶ ιβιανοῦ καὶ Πύρος ξ εὐτυχῶς	lapis		42.5288087	26.4770012		http://db.edcs.eu/epigr/bilder.php?bilder.php?s_language=en&bild=$BEJA-2017-208.jpg;$BEJA-2017-208_1.jpg	http://db.edcs.eu/epigr/partner.php?s_language=en&param=HD044469;bu_AE%26bibl_volume=1999%26bibl_subvolume=%26bibl_insc=1374			208 to 208
EDCS-72400142	BEJA-2017-214	Thracia	Kabile / Cabyle					tituli sacri	Asclepio / et (H)ygia[e] / sacrum / p(osuit) ex [voto] / [	Asclepio et ygia sacrum p ex	Asclepio et Hygiae sacrum posuit ex voto			42.5288087	26.4770012						
EDCS-16200562	BEJA-2017-218 = AE 1999, 01380 = AE 2017, 01266a3	Thracia	Kabile / Cabyle	71	130	71	130	milites;  tituli sacri;  tria nomina;  viri	C(aius) Egnatius Rufus / |(centurio) v(otum) s(olvit) l(ibens) m(erito)	C Egnatius Rufus v s l m	Caius Egnatius Rufus centurio votum solvit libens merito	lapis		42.5288087	26.4770012		http://db.edcs.eu/epigr/bilder.php?bilder.php?s_language=en&bild=$BEJA-2017-218.jpg;$BEJA-2017-218_1.jpg	http://db.edcs.eu/epigr/partner.php?s_language=en&param=HD045098			71 to 130
EDCS-72400144	BEJA-2017-225 = AE 1999, 01383 = AE 2017, 01266a5	Thracia	Kabile / Cabyle	151	250	151	250	milites;  mulieres;  officium/professio;  ordo equester;  servi/servae;  tituli sepulcrales;  viri	p]raef[ect 3] / [3] Ulpia Luc[3] / [cu]m marito su[o] / [Au]relio Nar(ali?) s[er(vo?)] / [a]ctor(e) et nep(o)t(e) [s(uo?)] / T(ito) Ulp(io?) Luc()	praef Ulpia Luc m marito su relio Nar s ctor et nept T Ulp Luc	praefect Ulpia Luc cum marito suo Aurelio Narali servo actore et nepote suo Tito Ulpio Luc	lapis		42.5288087	26.4770012		http://db.edcs.eu/epigr/bilder.php?bilder.php?s_language=en&bild=$BEJA-2017-225.jpg	http://db.edcs.eu/epigr/partner.php?s_language=en&param=HD045099			151 to 250
EDCS-16200557	GeA 00471 = AE 1991, 01402 = AE 1999, 01370	Thracia	Kabile / Cabyle	135	136	135	136	milites;  ordo equester;  tituli operum;  tituli sacri;  tria nomina;  viri	I(ovi) O(ptimo) M(aximo) / Cl(audius) Lupus praef(ectus) / coh(ortis) II Luc(ensium) locum / consecravit qui et castr(a) posuit	I O M Cl Lupus praef coh II Luc locum consecravit qui et castr posuit	Iovi Optimo Maximo Claudius Lupus praefectus cohortis II Lucensium locum consecravit qui et castra posuit	lapis		42.5288087	26.4770012		http://db.edcs.eu/epigr/bilder.php?bilder.php?s_language=en&bild=$AE_1999_01370.jpg;$AE_1991_01402.jpg;$AE_1991_01402_1.jpg	http://db.edcs.eu/epigr/partner.php?s_language=en&param=HD016208			135 to 136
EDCS-72400143	IGBR-03-01, 01777 = IGBR-05, 05635 = BEJA-2017-224 = AE 2017, 01266a4	Thracia	Kabile / Cabyle					milites;  mulieres;  tituli operum;  tituli sepulcrales;  tria nomina;  viri	C(aius) Avilius Valens ex |(centurione) vet(e)ranus Satriae Marciae [co]niug<i=E> sua(e) bene merita(e) et sibi viv(u)s et sapiens tumulum fecit // 	C Avilius Valens ex vetranus Satriae Marciae niugE sua bene merita et sibi vivs et sapiens tumulum fecit	Caius Avilius Valens ex centurione veteranus Satriae Marciae coniugi suae bene meritae et sibi vivus et sapiens tumulum fecit	lapis		42.5288087	26.4770012	GR					
EDCS-78300256	SEG-42, 00645 = AE 2017, 01266a6	Thracia	Kabile / Cabyle	297	297	297	297	tituli operum;  viri	[6] / [3]Μ[3]ΙΕΠΑΝΩΝ / [3]ΔΕ+ΙΑΙΝΑ[3]ΗΑΝΑΚ / ΑΡ+ΟΒΕ+ ἡγεμονεύο[ντος τοῦ δεῖνα] / ΑΡΟΥ διασημ(ότατος) ΔΟΥΙΔΟ / [3]ΕΙΝ ὑπατεύον[το]ς / [3]Ε[3]ΙΥΑ[3] Αὐρ(ήλιος?) / [3]ΙΝΚ[3]ΥΛΝΟΝ / [6]	Μ ΙΕΠΑΝΩΝ ΔΕ ΙΑΙΝΑ ΗΑΝΑΚ ΑΡ ΟΒΕ ἡγεμονεύο ΑΡΟΥ διασημ ΔΟΥΙΔΟ ΕΙΝ ὑπατεύονς Ε ΙΥΑ Αὐρ ΙΝΚ ΥΛΝΟΝ	Μ ΙΕΠΑΝΩΝ ΔΕ ΙΑΙΝΑ ΗΑΝΑΚ ΑΡ ΟΒΕ ἡγεμονεύοντος τοῦ δεῖνα ΑΡΟΥ διασημότατος ΔΟΥΙΔΟ ΕΙΝ ὑπατεύοντος Ε ΙΥΑ Αὐρήλιος ΙΝΚ ΥΛΝΟΝ	lapis		42.5288087	26.4770012			http://db.edcs.eu/epigr/partner.php?s_language=en&param=P171924			297 to 297
EDCS-28500167	CIL 03, 07619b	Thracia	Kadikoy					milites;  sigilla impressa;  tituli fabricationis	Leg(ionis) XI Cl(audiae) P(iae) Fid(elis)	Leg XI Cl P Fid	Legionis XI Claudiae Piae Fidelis	opus figlinae		41.854652	27.207743						
EDCS-31300269	CIL 03, 12526 = D 09112 = IScM-04, 00143h	Thracia	Kadikoy					milites;  sigilla impressa;  tituli fabricationis	[Leg(ionis) XI] Cl(audiae) f(iglinae) Tra(ns)m(ariscae)	Cl f Tram	Legionis XI Claudiae figlinae Transmariscae	opus figlinae		41.854652	27.207743			http://db.edcs.eu/epigr/partner.php?s_language=en&param=de-c0075;bu_IScM%26bibl_volume=4%26bibl_subvolume=%26bibl_insc=143h			
EDCS-79000094	AE 1939, 00117 = IGBulg-03-01, 01472	Thracia	Kaloyanovo	211	212	211	212	termini;  tria nomina;  viri	[κατὰ θεῖαν ἀπόφα]/σιν τεθέν[τες ὑπὸ Κ(οΐντου) Ἀτρί]/ου Κλονίου [πρεσβ(ευτοῦ) Σε{β}β(αστῶν)] / ἀντιστρ(ατήγου) διὰ Μ[ουκίου] / Οὐήρου ὅροι / ἀγροῦ Βενδιπαρω[ν]	σιν τεθένου Κλονίου ἀντιστρ διὰ Μ Οὐήρου ὅροι ἀγροῦ Βενδιπαρω	κατὰ θεῖαν ἀπόφασιν τεθέντες ὑπὸ Κοΐντου Ἀτρίου Κλονίου πρεσβευτοῦ Σεβαστῶν ἀντιστρατήγου διὰ Μουκίου Οὐήρου ὅροι ἀγροῦ Βενδιπαρων	lapis		42.3546355	24.7326425			http://db.edcs.eu/epigr/partner.php?s_language=en&param=P169558;1ae1939-35			211 to 212
EDCS-34200052	CIL 03, 07413 = IBulgarien 00228 = IIulian 00051 = ArchBulg-2019-64	Thracia	Kalugerovo						 // Imp(erator) Ca[esar // ]ONN[3] / [3]IM[ // D(omino) [n(ostro) Imp(eratori) Caes(ari) Fl(avio) Val(erio?)] / Const[antino max(imo) Aug(usto) et] / Cl(audio) Constan[ti]no et [Iul(io?)] / Consta(n)<ti=S> nobb(ilissimis) [Caess(aribus)] / bono rei [pu]blica / natis // Salvo d(omino) n(ostro) / Fl(avio) Cl(audio) Iuliano / semper Aug(usto)	Imp CaONN IM D Const Cl Constanno et ConstaS nobb bono rei blica natis Salvo d n Fl Cl Iuliano semper Aug	Imperator Caesar ONN IM Domino nostro Imperatori Caesari Flavio Valerio Constantino maximo Augusto et Claudio Constantino et Iulio Constanti nobbilissimis Caessaribus bono rei publica natis Salvo domino nostro Flavio Claudio Iuliano semper Augusto			42.325750	24.165100	GR	http://db.edcs.eu/epigr/bilder.php?bilder.php?s_language=en&bild=$IIiulian_00051_1.jpg;$IIiulian_00051_2.jpg	http://db.edcs.eu/epigr/partner.php?s_language=en&param=bu_CIL%26bibl_volume=3%26bibl_subvolume=%26bibl_insc=7413			
EDCS-78300637	AE 1921, 00053	Thracia	Kamenitza					tituli sacri				lapis		42.144308	24.7656641	GR		http://db.edcs.eu/epigr/partner.php?s_language=en&param=1ae1921-17			
EDCS-67200653	SEG-45, 00847 = AE 1995, 01359	Thracia	Karanovo / Augusta Traiana						Αὐ(ρήλιος) Δερζειζε/νις στρατιώτης / Δισερνῳ εὐχήν	Αὐ Δερζειζενις στρατιώτης Δισερνῳ εὐχήν	Αὐρήλιος Δερζειζενις στρατιώτης Δισερνῳ εὐχήν			42.5116829	25.9151501			http://db.edcs.eu/epigr/partner.php?s_language=en&param=HD067027			
